category,token_or_syntax,parser_action,ast_node_created,apple_clang_impl_point,cleanroom_implementation_notes
entry_keywords,"`kernel`, `vertex`, `fragment`, `mesh`, `object`, `tile`",Intercept function declaration specifiers; attach MSL entry stage token (`tok::kw_kernel` etc.).,DeclSpec -> FunctionDecl with `MetalKernelAttr` / `MetalVertexAttr` etc.,Parser::ParseFunctionDeclarator / ParseDeclSpec,Recognized as contextual or hard keywords when `-x metal` / `-fmetal` is active
address_spaces,"`device`, `constant`, `threadgroup`, `thread`, `ray_data`, `object_data`","Parse address space type qualifiers; attach `Qualifiers::AddressSpace` (`LangAS::opencl_global` -> `as1` device, `as2` constant, `as3` threadgroup).",AttributedType / QualType with exact address space modifier (`as1..as9`),Parser::ParseTypeQualifierListOpt / ParseDeclarator,Lexer token `tok::kw_device` maps directly to target address space index in `TargetInfo`
attributes_bracket,"`[[buffer(N)]]`, `[[texture(N)]]`, `[[sampler(N)]]`, `[[threadgroup(N)]]`",Parse C++11 double bracket attribute syntax `[[...]]`; evaluate integer constant expression `N` inside parentheses.,MetalBufferIndexAttr / MetalTextureIndexAttr / MetalSamplerIndexAttr (`IntegerLiteral` `N`),Parser::ParseCXX11Attributes -> SemaDeclAttr::handleMetalResourceIndexAttr,Recognized on `ParmVarDecl` of entry functions and struct fields
attributes_grid,"`[[thread_position_in_grid]]`, `[[thread_index_in_threadgroup]]`, `[[dispatch_threads_per_grid]]`",Parse zero-argument entry stage parameter attributes `[[...]]`.,MetalThreadPosGridAttr / MetalThreadIndexInThreadGroupAttr / MetalDispatchThreadsPerGridAttr,Parser::ParseCXX11Attributes -> SemaDeclAttr::handleMetalThreadPosAttr,Injects implicit system register read (`s0..s2`) during CodeGen
attributes_stage,"`[[stage_in]]`, `[[color(N)]]`, `[[position]]`, `[[point_size]]`",Parse vertex/fragment pipeline input/output semantics attributes.,MetalStageInAttr / MetalColorIndexAttr / MetalPositionAttr / MetalPointSizeAttr,Parser::ParseCXX11Attributes -> SemaDeclAttr::handleMetalPipelineStageAttr,Validates struct field packing and link-time interface compatibility
opaque_templates,"`vec<T,N>`, `matrix<T,C,R>`, `texture2d<T,access>`",Parse MSL standard library C++ template specialization syntax (`ClassTemplateSpecializationDecl`).,ClassTemplateSpecializationDecl / TypedefDecl (e.g. `__metal_texture_2d_t`),Parser::ParseClassTemplateId -> SemaTemplateInstantiate,MSL stdlib headers map template instantiations to internal `__metal_*_t` opaque types
pragmas,"`#pragma unroll N`, `#pragma clang fp contract(fast)`",Parse compiler directives controlling loop unrolling and floating point contraction.,LoopHintAttr / FloatingPointModeAttr inside `AttributedStmt`,Parser::ParsePragmaLoopHint / ParsePragmaClangFP,Translates into LLVM loop metadata `!llvm.loop.unroll.count` and `fast-math` flags
